<?xml version="1.0" encoding="UTF-8" standalone="no"?>
<!DOCTYPE Person SYSTEM "Test_UTF-8_ext.dtd">
<gsr:Person xmlns:gsr="urn:GalenSherardRhodes"
            xmlns:usa="urn:UnitedStatesOfAmerica"
            xmlns:pgx="http://pgx.galenrhodes.com"
            xmlns:ack="urn:dccommics"
            xmlns:des="urn:rhodes"
            xmlns:rho="urn:rhodes"
            xmlns="urn:Canada">
    <!-- Galen Rhodes was here! -->
    <gsr:LastName pgx:type="German" gsr:type="nickname">Rhodes</gsr:LastName>
    <gsr:FirstName>Galen</gsr:FirstName>
    <MiddleName preferred="YES">Sherard</MiddleName>
    <pgx:dob pgx:type="Julian">12 December 1967</pgx:dob>
    <bob:info xmlns:bob="urn:minions" xmlns:ack="urn:bill.the.cat" id="1" type="demo" gsr:region="UK">
        <bob:dob pgx:type="Gregorian">25 November 1970</bob:dob>
        <ack:nickname>&smiley;Glenn&smiley;</ack:nickname>
    </bob:info>
    <usa:family des:type="fam" rho:type="fam">Galen &copyright; Rhodes</usa:family>
    <garfield/>
    <ack:Batman>Wonder Woman</ack:Batman>
</gsr:Person>
